reviews,category
worst airline i’ve ever used,"['Cabin Environment', 'Brand Reputation', 'Boarding Process']"
legroom is more than okay,"['Seat Comfort', 'Miscellaneous']"
a satisfactory experience,"['In-flight Experience', 'Miscellaneous']"
airline has lost my baggage,"['Cabin Environment', 'Baggage Policies', 'Boarding Process']"
a most average experience,"['In-flight Experience', 'Miscellaneous']"
go online and read the baggage policy,"['Wi-Fi & Connectivity', 'Baggage Policies', 'Process & Policy', 'Boarding Process']"
claiming that i need a visa to transit,['Compensation & Refund']
worst flight i have ever been on,['Brand Reputation']
$215 due to 2 overweight suitcases,['Baggage Policies']
didn’t give you free headphones,['Inflight Entertainment']
anxiety experienced with online booking,"['Wi-Fi & Connectivity', 'Ticket Booking & Pricing', 'Boarding Process', 'In-flight Experience']"
provided no guarantee of a refund,"['Ticket Booking & Pricing', 'Compensation & Refund']"
price does not allow for much complaints,"['Value for Money', 'Ticket Booking & Pricing', 'Customer Service', 'Brand Reputation']"
"spacious, well bolstered seats",['Seat Comfort']
changed our seats all the way to the back,"['Seat Comfort', 'Ticket Booking & Pricing']"
avoid travelling with this company,['Brand Reputation']
better to avoid this company,['Brand Reputation']
a very bad experience,['In-flight Experience']
worst experience ever,"['Brand Reputation', 'In-flight Experience']"
worse airline ever,"['Cabin Environment', 'Boarding Process']"
not a bad airline!,"['Cabin Environment', 'Boarding Process']"
staff friendly and professional,['Staff Behaviour']
exceptional customer service skills,"['Staff Behaviour', 'Customer Service', 'In-flight Experience']"
a nice experience,['In-flight Experience']
both flights were on time,['Punctuality']
have lost our money for both flights,['Baggage Policies']
our baggage was not there,['Baggage Policies']
"denied a phone call, beverages and food","['Food & Beverages', 'Compensation & Refund', 'In-flight Experience']"
staff were attentive,['Staff Behaviour']
crew were polite and helpful,"['Staff Behaviour', 'In-flight Experience']"
catering is very basic,['Food & Beverages']
baggage allowance re sporting equipment,['Baggage Policies']
"courteous, smiling and helpful",['Staff Behaviour']
laziest cabin crew,"['Staff Behaviour', 'Cabin Environment', 'In-flight Experience']"
cabin crew were very friendly and efficient,"['Staff Behaviour', 'Cabin Environment', 'In-flight Experience']"
food was appalling,"['Food & Beverages', 'In-flight Experience']"
at least 2 hours of delay,['Punctuality']
quite disappointing experience,['In-flight Experience']
worst airline i have ever flown,"['Cabin Environment', 'Brand Reputation', 'Boarding Process']"
worst airline i've ever flown on,"['Cabin Environment', 'Brand Reputation', 'Boarding Process']"
feel welcome and comfortable,"['Seat Comfort', 'In-flight Experience']"
on the tarmac waiting and waiting,"['Punctuality', 'Boarding Process']"
no leg room in comfort class,"['Seat Comfort', 'In-flight Experience']"
the comfort was amazing,"['Seat Comfort', 'In-flight Experience']"
flight was delayed 3 hours,['Punctuality']
unbelievably terrible service,"['Staff Behaviour', 'Brand Reputation', 'In-flight Experience']"
worst of the worst,['Brand Reputation']
we never got a refund,"['Ticket Booking & Pricing', 'Compensation & Refund']"
worst airline i've travelled,"['Cabin Environment', 'Brand Reputation', 'Boarding Process']"
horrible confusing experience,"['Process & Policy', 'Brand Reputation', 'In-flight Experience']"
truly terrible service,"['Staff Behaviour', 'Brand Reputation', 'In-flight Experience']"
customer service is poor quality,"['Staff Behaviour', 'Customer Service', 'In-flight Experience']"
service seems to be falling apart,"['Staff Behaviour', 'In-flight Experience']"
no difference with economy service,"['Staff Behaviour', 'In-flight Experience']"
should be ashamed of themselves,['Brand Reputation']
orient thai airlines customer review,"['Cabin Environment', 'Boarding Process']"
orient thai airlines customer review,"['Cabin Environment', 'Boarding Process']"
orient thai airlines customer review,"['Cabin Environment', 'Boarding Process']"
orient thai airlines customer review,"['Cabin Environment', 'Boarding Process']"
orient thai airlines customer review,"['Cabin Environment', 'Boarding Process']"
orient thai airlines customer review,"['Cabin Environment', 'Boarding Process']"
orient thai airlines customer review,"['Cabin Environment', 'Boarding Process']"
orient thai airlines customer review,"['Cabin Environment', 'Boarding Process']"
orient thai airlines customer review,"['Cabin Environment', 'Boarding Process']"
it was a bad experience,['In-flight Experience']
force me to buy another ticket,['Ticket Booking & Pricing']
never had such a bad experience,['In-flight Experience']
unpleasant experience,['In-flight Experience']
avoid if possible,['Brand Reputation']
very bad experience,['In-flight Experience']
seats very hard,['Seat Comfort']
on time and fairly uneventful,"['Punctuality', 'Cabin Environment']"
meal was very impressive,['Food & Beverages']
worst airline ever,"['Cabin Environment', 'Brand Reputation', 'Boarding Process']"
very disappointed with the service,"['Staff Behaviour', 'In-flight Experience']"
not reply to any refund emails,"['Ticket Booking & Pricing', 'Compensation & Refund']"
never use this airline again,"['Cabin Environment', 'Boarding Process']"
the crew were amazing,"['Staff Behaviour', 'In-flight Experience']"
no air conditioning while boarding,"['Cabin Environment', 'Aircraft Maintenance', 'Boarding Process']"
they are extremely unprofessional,['Staff Behaviour']
seats had no reclining function,['Seat Comfort']
do not book with this airline,"['Cabin Environment', 'Boarding Process']"
service was pretty good,"['Staff Behaviour', 'In-flight Experience']"
please don't take this airline,"['Cabin Environment', 'Boarding Process']"
such a negative experience,['In-flight Experience']
luggage exceeded the total size by 5cm,['Baggage Policies']
chose to wait for 4 passengers running late,['Punctuality']
did not want me to get on the plane with that,['Aircraft Maintenance']
pay for baggage that i had already paid for,['Baggage Policies']
forcing me to buy a new ticket,['Ticket Booking & Pricing']
shameless company,['Brand Reputation']
refused to cover any costs,['Value for Money']
airline was profoundly disappointing,"['Cabin Environment', 'Boarding Process']"
deeply frustrating experience,['In-flight Experience']
light snack and water provided,['Food & Beverages']
terrible customer service,"['Staff Behaviour', 'Customer Service', 'Brand Reputation', 'In-flight Experience']"
service friendly and professional,"['Staff Behaviour', 'In-flight Experience']"
one of the worst,['Brand Reputation']
canceled flight and no refund,"['Ticket Booking & Pricing', 'Compensation & Refund']"
airline is a headache,"['Cabin Environment', 'Boarding Process']"
avoid at all costs!,"['Value for Money', 'Brand Reputation']"
worst airline i've taken,"['Cabin Environment', 'Brand Reputation', 'Boarding Process']"
aircraft over half empty,"['Cabin Environment', 'Aircraft Maintenance']"
the service is disgusting,"['Staff Behaviour', 'In-flight Experience']"
onboard service was very satisfactory,"['Staff Behaviour', 'In-flight Experience', 'Miscellaneous']"
ticket had a zero luggage allowance,"['Baggage Policies', 'Ticket Booking & Pricing']"
flight was smooth and on time,['Punctuality']
the crew showed how untrained they are,"['Staff Behaviour', 'In-flight Experience']"
ticket price was reasonable,"['Value for Money', 'Ticket Booking & Pricing']"
very bad service,"['Staff Behaviour', 'In-flight Experience']"
genuine service,"['Staff Behaviour', 'In-flight Experience']"
still waiting in the bridge,"['Punctuality', 'Boarding Process']"
delayed for 26 hours,['Punctuality']
refused any compensation,['Compensation & Refund']
a very nice experience,['In-flight Experience']
customer service is terrible,"['Staff Behaviour', 'Customer Service', 'Brand Reputation', 'In-flight Experience']"
wrongly denied boarding,"['Flight Cancellation', 'Compensation & Refund', 'Boarding Process']"
crew was eager to help,"['Staff Behaviour', 'In-flight Experience']"
disaster customer service,"['Staff Behaviour', 'Customer Service', 'In-flight Experience']"
unreasonably small sizes for hand luggage,['Baggage Policies']
problem is baggage allowance,['Baggage Policies']
read the rules and conditions,"['Aircraft Maintenance', 'Process & Policy']"
staff were impolite to me,['Staff Behaviour']
attendant said gate closed,['Staff Behaviour']
take any other airline,"['Cabin Environment', 'Boarding Process']"
i expected better service,"['Staff Behaviour', 'In-flight Experience']"
all in all a nice experience,['In-flight Experience']
ground staff were the problem,['Staff Behaviour']
still haven't given my family a refund,"['Ticket Booking & Pricing', 'Compensation & Refund']"
told no service dog was on record,"['Staff Behaviour', 'Aircraft Maintenance', 'In-flight Experience']"
pleasant crew,"['Staff Behaviour', 'In-flight Experience']"
disappointing check-in experience,"['Boarding Process', 'In-flight Experience']"
overall good experience,['In-flight Experience']
more like a bus service,"['Staff Behaviour', 'In-flight Experience']"
non existent customer service,"['Staff Behaviour', 'Customer Service', 'In-flight Experience']"
its a really good experience,['In-flight Experience']
a very bad experience,['In-flight Experience']
the worst customer service,"['Staff Behaviour', 'Customer Service', 'Brand Reputation', 'In-flight Experience']"
no water. no food. no apologies,"['Food & Beverages', 'In-flight Experience']"
it is a nightmare airline,"['Cabin Environment', 'Boarding Process']"
disgrace to their wonderful country,['Brand Reputation']
delayed 2.5 hours,['Punctuality']
major delays at both airports,"['Punctuality', 'Cabin Environment']"
was great value for money,['Value for Money']
do not book with this airline!,"['Cabin Environment', 'Boarding Process']"
absolutely delightful experience,['In-flight Experience']
awful experience all round,['In-flight Experience']
comfortable great service,"['Seat Comfort', 'Staff Behaviour', 'In-flight Experience']"
flight was comfortable,"['Seat Comfort', 'In-flight Experience']"
staff on board were amazing,['Staff Behaviour']
i had an amazing experience,['In-flight Experience']
avoid flying with them,['Brand Reputation']
aircraft is from 1990,"['Cabin Environment', 'Aircraft Maintenance']"
very disappointing inflight service,"['Staff Behaviour', 'In-flight Experience']"
totally unfair and unacceptable,['Cabin Environment']
really regret booking with qantas,['Ticket Booking & Pricing']
more like a budget carrier,['Value for Money']
a great experience,['In-flight Experience']
got charged $600 excess baggage,['Baggage Policies']
cabin crew really good,"['Staff Behaviour', 'Cabin Environment', 'In-flight Experience']"
a comfortable flight,"['Seat Comfort', 'In-flight Experience']"
cabin service was excellent,"['Staff Behaviour', 'Cabin Environment', 'In-flight Experience']"
cabin was unbearably cold,"['Cabin Environment', 'Aircraft Maintenance']"
indigo service not up to expectations,"['Staff Behaviour', 'In-flight Experience']"
very consistent service,"['Staff Behaviour', 'In-flight Experience']"
service was spot on,"['Staff Behaviour', 'In-flight Experience']"
top quality crew,"['Staff Behaviour', 'In-flight Experience']"
impressed with the service,"['Staff Behaviour', 'In-flight Experience']"
excellent and amazing value,['Value for Money']
delayed and i missed connection,"['Punctuality', 'Wi-Fi & Connectivity']"
give away your seat,['Seat Comfort']
overall experience was fantastic,"['In-flight Experience', 'Miscellaneous']"
issues with last minute delays,['Punctuality']
delayed with no explanation,['Punctuality']
was never on time,['Punctuality']
worst experience of my life,"['Brand Reputation', 'In-flight Experience']"
the worst experience ever,"['Brand Reputation', 'In-flight Experience']"
should improve their service attitude,"['Staff Behaviour', 'In-flight Experience']"
terrible experience,"['Brand Reputation', 'In-flight Experience']"
worst possible support staff,"['Staff Behaviour', 'Customer Service', 'Brand Reputation', 'Accessibility Needs']"
seats were good pitch,['Seat Comfort']
"it got hotter, and hotter",['Cabin Environment']
it was so hot on board,['Cabin Environment']
very pleased with the experience,['In-flight Experience']
thank you for refunding my ticket,"['Ticket Booking & Pricing', 'Compensation & Refund']"
one of the best flying experiences,['In-flight Experience']
consistently delayed,['Punctuality']
commend flight attendant georgia,['Staff Behaviour']
incredible service,"['Staff Behaviour', 'In-flight Experience']"
most reliable airline,"['Cabin Environment', 'Boarding Process']"
excellent customer service,"['Staff Behaviour', 'Customer Service', 'In-flight Experience']"
a truly great experience,['In-flight Experience']
personal and professional service,"['Staff Behaviour', 'In-flight Experience']"
experience really was good,['In-flight Experience']
great experience,['In-flight Experience']
totally not worth it,['Value for Money']
"great service, nice food","['Food & Beverages', 'Staff Behaviour', 'In-flight Experience']"
no complaints about rossiya,"['Customer Service', 'Brand Reputation']"
friendly staff won me over,['Staff Behaviour']
comfortable seats,"['Seat Comfort', 'In-flight Experience']"
customer service is 0/10,"['Staff Behaviour', 'Customer Service', 'In-flight Experience']"
a great experience with ram,['In-flight Experience']
luggage has still not been identified,['Baggage Policies']
seat not cleaned,"['Seat Comfort', 'Hygiene']"
such poor customer service,"['Staff Behaviour', 'Customer Service', 'In-flight Experience']"
not resolving lost luggage issues,['Baggage Policies']
worst customer service,"['Staff Behaviour', 'Customer Service', 'Brand Reputation', 'In-flight Experience']"
i did not accept this compensation,['Compensation & Refund']
disappointing experience,['In-flight Experience']
very bad experience,['In-flight Experience']
excellent service,"['Staff Behaviour', 'In-flight Experience']"
deeply appreciate his assistance,"['Staff Behaviour', 'Customer Service', 'Accessibility Needs']"
exceptional assistance,"['Staff Behaviour', 'Customer Service', 'Accessibility Needs']"
cabin service is outstanding,"['Staff Behaviour', 'Cabin Environment', 'In-flight Experience']"
best airline i have flown,"['Cabin Environment', 'Boarding Process']"
crew disinterested,"['Staff Behaviour', 'In-flight Experience']"
regret spending money on this upgrade,['Ticket Booking & Pricing']
it has become a budget carrier,['Value for Money']
disorganization and poor service,"['Staff Behaviour', 'In-flight Experience']"
will never book with this airline again,"['Cabin Environment', 'Boarding Process']"
a good experience,['In-flight Experience']
they changed my departure date,['Ticket Booking & Pricing']
leaving the tickets as credit,['Ticket Booking & Pricing']
flight staff are friendly,['Staff Behaviour']
service impeccable,"['Staff Behaviour', 'In-flight Experience']"
delay after delay,['Punctuality']
catering faultless,['Food & Beverages']
extremely good value for money,['Value for Money']
delayed kigali to london by 11 hours,['Punctuality']
interior of aircraft was very worn,"['Cabin Environment', 'Aircraft Maintenance']"
"seats were nice, but very cramped",['Seat Comfort']
worst experience ever,"['Brand Reputation', 'In-flight Experience']"
not worth the hassle,['Value for Money']
made me pay for my baggage,['Baggage Policies']
love ryanair efficiency,['Cabin Environment']
experience was beyond shocking,['In-flight Experience']
does not do refunds or credits,"['Ticket Booking & Pricing', 'Compensation & Refund']"
€37 to check in the cabin bag,['Cabin Environment']
the tickets are so overpriced,"['Value for Money', 'Ticket Booking & Pricing']"
"excellent service, thank you!","['Staff Behaviour', 'In-flight Experience']"
the worst airline in russia,"['Cabin Environment', 'Brand Reputation', 'Boarding Process']"
left at alicante airport,['Cabin Environment']
good value for money,['Value for Money']
very good experience,['In-flight Experience']
not allow my hand luggage,['Baggage Policies']
slow on board service,"['Staff Behaviour', 'Wi-Fi & Connectivity', 'Boarding Process', 'In-flight Experience']"
"no staff, no explanation",['Staff Behaviour']
customer service is no existent,"['Staff Behaviour', 'Customer Service', 'In-flight Experience']"
no reason given for flight delay,['Punctuality']
told to book another flight,['Aircraft Maintenance']
excellent customer service,"['Staff Behaviour', 'Customer Service', 'In-flight Experience']"
crews were friendly,"['Staff Behaviour', 'In-flight Experience']"
safi airways are terrible,"['Cabin Environment', 'Brand Reputation']"
very bad experience,['In-flight Experience']
provides almost nothing as a service,"['Staff Behaviour', 'In-flight Experience']"
a disappointing experience,['In-flight Experience']
rude and arrogant flying staff,['Staff Behaviour']
expensive and terrible experience,"['Value for Money', 'Brand Reputation', 'In-flight Experience']"
never fly again with salam air,['Cabin Environment']
horrible customer service,"['Staff Behaviour', 'Customer Service', 'Brand Reputation', 'In-flight Experience']"
the worst airline ever,"['Cabin Environment', 'Brand Reputation', 'Boarding Process']"
worst airline i've ever flown,"['Cabin Environment', 'Brand Reputation', 'Boarding Process']"
offered no partial refund for inconvenience,"['Ticket Booking & Pricing', 'Compensation & Refund']"
avoid this airline,"['Cabin Environment', 'Brand Reputation', 'Boarding Process']"
refuses to refund me,"['Ticket Booking & Pricing', 'Compensation & Refund']"
avoid this airline,"['Cabin Environment', 'Brand Reputation', 'Boarding Process']"
santa barbara airlines customer review,"['Cabin Environment', 'Boarding Process']"
santa barbara airlines customer review,"['Cabin Environment', 'Boarding Process']"
santa barbara airlines customer review,"['Cabin Environment', 'Boarding Process']"
santa barbara airlines customer review,"['Cabin Environment', 'Boarding Process']"
santa barbara airlines customer review,"['Cabin Environment', 'Boarding Process']"
santa barbara airlines customer review,"['Cabin Environment', 'Boarding Process']"
santa barbara airlines customer review,"['Cabin Environment', 'Boarding Process']"
santa barbara airlines customer review,"['Cabin Environment', 'Boarding Process']"
santa barbara airlines customer review,"['Cabin Environment', 'Boarding Process']"
on time and good flights,['Punctuality']
denied reimbursement for alcohol,['Compensation & Refund']
a terrible way to treat your customers,['Brand Reputation']
a delightful experience,['In-flight Experience']
service is typically very poor,"['Staff Behaviour', 'In-flight Experience']"
still waiting for the compensation,"['Punctuality', 'Compensation & Refund', 'Boarding Process']"
finally received our refund,"['Ticket Booking & Pricing', 'Compensation & Refund']"
aircraft very clean and spotless,"['Hygiene', 'Cabin Environment', 'Aircraft Maintenance']"
no entertainment system and no wifi,"['Inflight Entertainment', 'Wi-Fi & Connectivity', 'In-flight Experience']"
a horrible experience,"['Brand Reputation', 'In-flight Experience']"
spent 12 hours in airport,['Cabin Environment']
really good experience,['In-flight Experience']
delay of almost 4 hours,['Punctuality']
book with a different airline,"['Cabin Environment', 'Boarding Process']"
avoid sata airlines if possible,"['Cabin Environment', 'Brand Reputation', 'Boarding Process']"
thoroughly enjoyed our experience,['In-flight Experience']
staff was professional,['Staff Behaviour']
sata won't give me a refund,"['Ticket Booking & Pricing', 'Compensation & Refund']"
refuse to pay flight delay compensation,"['Punctuality', 'Compensation & Refund']"
bad customer service,"['Staff Behaviour', 'Customer Service', 'In-flight Experience']"
avoid this airline like the plague,"['Cabin Environment', 'Brand Reputation', 'Boarding Process']"
don't recommend using this airline,"['Cabin Environment', 'Boarding Process']"
"terrible, terrible service","['Staff Behaviour', 'Brand Reputation', 'In-flight Experience']"
the worst flight i have travelled,['Brand Reputation']
friendly and amazing service,"['Staff Behaviour', 'In-flight Experience']"
not professional service at all,"['Staff Behaviour', 'In-flight Experience']"
a decent service,"['Staff Behaviour', 'In-flight Experience']"
not sure it is worth it,['Value for Money']
wouldn’t recommend this airline,"['Cabin Environment', 'Boarding Process']"
pretty atrocious service standards,"['Staff Behaviour', 'In-flight Experience']"
didn't load all our luggage,['Baggage Policies']
departure time changed by almost 24 hr,['Ticket Booking & Pricing']
boarding was pretty chaotic,['Boarding Process']
overall a pleasant experience,['In-flight Experience']
delay at least 30 min,['Punctuality']
never fly this airline,"['Cabin Environment', 'Boarding Process']"
worst airline i ever flew,"['Cabin Environment', 'Brand Reputation', 'Boarding Process']"
horrible customer service ,"['Staff Behaviour', 'Customer Service', 'Brand Reputation', 'In-flight Experience']"
don't recommend seaborne airlines,"['Cabin Environment', 'Boarding Process']"
third class airline,"['Cabin Environment', 'Boarding Process']"
no explanation or compensation,['Compensation & Refund']
really disappointing experience,['In-flight Experience']
worst airline ever,"['Cabin Environment', 'Brand Reputation', 'Boarding Process']"
long unpredictable delays,['Punctuality']
flight delayed by more than 2 hours,['Punctuality']
good quality food served,"['Food & Beverages', 'In-flight Experience']"
cabin crew friendly,"['Staff Behaviour', 'Cabin Environment', 'In-flight Experience']"
smiles on the faces of the cabin crew,"['Staff Behaviour', 'Cabin Environment', 'In-flight Experience']"
very disappointed with the staff,['Staff Behaviour']
ticket was booked wrong,['Ticket Booking & Pricing']
meal was very poor,['Food & Beverages']
is a pathetic airline,"['Cabin Environment', 'Boarding Process']"
happy with the service,"['Staff Behaviour', 'In-flight Experience']"
"comfortable, clean and modern plane","['Seat Comfort', 'Hygiene', 'Aircraft Maintenance', 'In-flight Experience']"
crew was very attentive,"['Staff Behaviour', 'In-flight Experience']"
impressed on the cabin cleanliness,"['Hygiene', 'Cabin Environment', 'Boarding Process']"
old fashioned business class seats,"['Seat Comfort', 'Aircraft Maintenance']"
miserable food for a business class,"['Food & Beverages', 'In-flight Experience']"
"punctuality, good service","['Staff Behaviour', 'Punctuality', 'In-flight Experience']"
delayed for 16 hours,['Punctuality']
cabin crew tells me to be quiet,"['Staff Behaviour', 'Cabin Environment', 'In-flight Experience']"
overall a good experience,['In-flight Experience']
worst airline i’ve ever encountered,"['Cabin Environment', 'Brand Reputation', 'Boarding Process']"
poor quality service,"['Staff Behaviour', 'In-flight Experience']"
they have no service awful staff,"['Staff Behaviour', 'In-flight Experience']"
plane was 40% empty,['Aircraft Maintenance']
i would avoid shenzhen airlines,"['Cabin Environment', 'Brand Reputation', 'Boarding Process']"
customer service is non existent,"['Staff Behaviour', 'Customer Service', 'In-flight Experience']"
very good value for money,['Value for Money']
not be able to claim for travel insurance,['Compensation & Refund']
no food and drink service during the flight,"['Food & Beverages', 'Staff Behaviour', 'In-flight Experience']"
playing refunding trick,"['Ticket Booking & Pricing', 'Compensation & Refund']"
worst flight i ever had to china,['Brand Reputation']
poor cabin hygiene,"['Hygiene', 'Cabin Environment']"
there is no customer service,"['Staff Behaviour', 'Customer Service', 'In-flight Experience']"
sichuan airlines is scamming us,"['Cabin Environment', 'Boarding Process']"
service was impressive,"['Staff Behaviour', 'In-flight Experience']"
concerned about the covid safety of this flight,"['Aircraft Maintenance', 'Security Concerns']"
"comfortable, good service","['Seat Comfort', 'Staff Behaviour', 'In-flight Experience']"
long check-in queue,['Boarding Process']
not recommend using silkair,['Cabin Environment']
worst experience in my life,"['Brand Reputation', 'In-flight Experience']"
not recommend this airline,"['Cabin Environment', 'Boarding Process']"
silkair is shockingly bad,['Cabin Environment']
gate personnel was as cold as stone,"['Cabin Environment', 'Aircraft Maintenance']"
service is not on this company’s radar,"['Staff Behaviour', 'In-flight Experience']"
terrible terrible airline!,"['Cabin Environment', 'Brand Reputation', 'Boarding Process']"
terrible service,"['Staff Behaviour', 'Brand Reputation', 'In-flight Experience']"
do not fly in this airline,"['Cabin Environment', 'Boarding Process']"
delayed over and over again,['Punctuality']
so delayed we couldn't wait,['Punctuality']
below average pitch and recline,"['Seat Comfort', 'Boarding Process', 'Miscellaneous']"
no dining on demand,['Food & Beverages']
the screen of my seat was not working,"['Inflight Entertainment', 'Seat Comfort']"
average in terms of comfort,"['Seat Comfort', 'In-flight Experience', 'Miscellaneous']"
